ID,Review Date,Location,Hotel/Restaurant name,Review
rn509552578,"Reviewed August 7, 2017 ", Rawai,COCONUT Bar & Restaurant - Rawai Beach,Great happy hour. Big screen T.V. to watch sporting events. Cold beer and good service. Very comfortable chairs.
rn508879368,"Reviewed August 4, 2017 ", Rawai,COCONUT Bar & Restaurant - Rawai Beach,"Nice little rd side bar to drop into for a fee beers to cool of . Great burger and good food .
Looks clean and has great staff"
rn506672941,"Reviewed July 29, 2017 ", Rawai,COCONUT Bar & Restaurant - Rawai Beach,What a friendly place. We were here with 2 kids and staff could not have been more welcoming. This is an (expat) locals' place and seems to cover sports events off. Located near the beach. Very very clean. Staff were great and look forward to...More
rn502470412,"Reviewed July 16, 2017 ", Rawai,COCONUT Bar & Restaurant - Rawai Beach,"Very chill, waitresses were a little apprehensive, seemed laid back. Easy location while walking down the beach. Open front. Had a delicious smoothie and thai salad."
rn498987702,"Reviewed July 5, 2017 ", Rawai,COCONUT Bar & Restaurant - Rawai Beach,"While staying in Rawai we stopped for a drink at Coconut Bar & Restaurant.
This place has amazing food and the atmosphere is very inviting. They played the best music, I couldn't help but sing along.
Congratulations on a great little place to sit and...More"
rn498982689,"Reviewed July 5, 2017 ", Rawai,COCONUT Bar & Restaurant - Rawai Beach,"Good food at a moderate price, friendly staff, decent sized menu, nice location with a good view of the beach"
rn488345074,"Reviewed May 27, 2017 ", Rawai,COCONUT Bar & Restaurant - Rawai Beach,We went here for a few beers and a light snack while we watched the super rugby. The staff were nice and service was good. The food and drinks were reasonable priced
rn481579163,"Reviewed May 4, 2017 ", Rawai,COCONUT Bar & Restaurant - Rawai Beach,The food was average and the restaurant was lacking atmosphere. Generally overpriced and so unlikely to return
rn481563724,"Reviewed May 4, 2017 ", Rawai,COCONUT Bar & Restaurant - Rawai Beach,Good location BUT we come for the UFC fight night on the Sunday morning in Thailand. Th fight was advertised for an 8am start which we arrived at that time we were asked to come back in 30 mins as they don't open until than....More
rn478344861,"Reviewed April 23, 2017 ", Rawai,COCONUT Bar & Restaurant - Rawai Beach,Went to this Restaurant for lunch on 22nd April -2017 with few of our friends. The server was most Xenophobic woman that I have ever met in Thailand. As soon as we entered the restaurant we got the vibe that we were not welcome in...More
rn477932347,"Reviewed April 22, 2017 ", Rawai,COCONUT Bar & Restaurant - Rawai Beach,If you want to sit next to a woman feeding her dog at the table next to you then this is the place. The woman next to us was chewing up her food & spitting it out for her dog to eat. Absolutely disgusting. Over...More
rn477266474,"Reviewed April 19, 2017 ", Rawai,COCONUT Bar & Restaurant - Rawai Beach,Good food reasonably priced but staff are not at all friendly. If they could smile and provide better service I would rate higher
rn476676808,"Reviewed April 17, 2017 ", Rawai,COCONUT Bar & Restaurant - Rawai Beach,Good Thai and Western food.I ate here many times for lunch and dinner and you can also get breakfast.If you are not hungry you can sit at the bar and have an ice cold beverage.Recommended.
rn476253738,"Reviewed April 16, 2017 ", Rawai,COCONUT Bar & Restaurant - Rawai Beach,"Food is Okay and Quite passable. We actually ate there 3 times during our stay. Service is quick and friendly. Would have got a higher mark if it did not allow people to smoke in the downstairs restaurant area.
When somebody started to smoke we...More"
rn474480130,"Reviewed April 11, 2017 ", Rawai,COCONUT Bar & Restaurant - Rawai Beach,If you are new to Rawai then this is a bar-restaurant that is well worth a visit. There is always plenty of staff available and the welcome is very friendly. Food is always fresh and the choice is excellent. After a day at the beach...More
rn472867937,"Reviewed April 5, 2017 ", Rawai,COCONUT Bar & Restaurant - Rawai Beach,Great place for a stop and refresh after a long day or in the morning for breakfast. Good food both European and Thai food recommended.
rn468217289,"Reviewed March 18, 2017 ", Rawai,COCONUT Bar & Restaurant - Rawai Beach,"Just popped in for a late breakfast.
Standard kind of food, eggs, bacon, sausage etc.
All good and fresh brewed coffee which was a bonus.
Service was ok, there was only a few customers so the girls looked a bit bored."
rn465759763,"Reviewed March 9, 2017 ", Rawai,COCONUT Bar & Restaurant - Rawai Beach,"Stopped in here on the way back to Chalong and had a fantastic meal! Service was also very good and the atmosphere was very relaxed and pleasant as well.
I would highly recommend Coconut restaurant, Their menu states that all of their food is fresh...More"
rn464578234,"Reviewed March 4, 2017 ", Rawai,COCONUT Bar & Restaurant - Rawai Beach,"My husband and I stumbled across this restaurant and are so glad we did. They have the BEST red curry and also coconut soup and spicy mango salad we had the whole 2 weeks we were in Thailand. Staff was great, restaurant (including bathrooms) was...More"
rn464382729,"Reviewed March 3, 2017 ", Rawai,COCONUT Bar & Restaurant - Rawai Beach,"We just happened upon this bar as we were wondering along the Main Street of Rawai beach. It was a fun place to people watch, catch a game on their tv screens, enjoy a chicken satay snack and a cold beer. Friendly English speaking staff....More"
rn462856620,"Reviewed February 25, 2017 ", Rawai,COCONUT Bar & Restaurant - Rawai Beach,We went here on our last night in Phuket. It's a shame we didn't come earlier in our stay as I would've happily eaten there more often. The food was yummy and reasonably priced. The wait staff were efficient and friendly. There was a good...More
rn462397951,"Reviewed February 23, 2017 ", Rawai,COCONUT Bar & Restaurant - Rawai Beach,Good international and Thai food. Nice tropical atmosphere. Friendly staff. If you wish to relax and more quiter on the upper floor. Good value for money.
rn461724342,"Reviewed February 21, 2017 ", Rawai,COCONUT Bar & Restaurant - Rawai Beach,"We ate here several times on holiday, the place is very clean, the food is very good and it all arrives at the same time which is a bonus in Thailand! Would definitely reccomend this place"
rn461290041,"Reviewed February 19, 2017 ", Rawai,COCONUT Bar & Restaurant - Rawai Beach,Excellent food. Best place to eat in Rawai. Nice people. Great food. I really recommend this restsurant.
rn460765976,"Reviewed February 17, 2017 ", Rawai,COCONUT Bar & Restaurant - Rawai Beach,"I went here with the wife and kids based on the reviews I had seen here.
The staff were very friendly, and welcoming.
It's a fairly typical pub for the area with sports playing on a number of screens and a sort of tropical, open...More"
rn458393813,"Reviewed February 9, 2017 ", Rawai,COCONUT Bar & Restaurant - Rawai Beach,"Must be nice as we ate here twice, once English food and the other Thai. Both really nice and a bonus that English footie is shown."
rn458200048,"Reviewed February 8, 2017 ", Rawai,COCONUT Bar & Restaurant - Rawai Beach,"This is a very popular place with ex pats from morning till night
Live sports on good TV
Friendly staff
Good coffee
Great view
Prices on the higher side but nice spot to relax with plenty of fans to keep you cool"
rn454658477,"Reviewed January 24, 2017 ", Rawai,COCONUT Bar & Restaurant - Rawai Beach,Cosy and cheap restaurant in Rawai at the beach road. Food was delicious! I would go back anytime :)
rn454287542,"Reviewed January 23, 2017 ", Rawai,COCONUT Bar & Restaurant - Rawai Beach,"We went there with no expectations. Staff was friendly and very fast (it didn't have a lot of costumers, though). Food (red curry chicken) was delicious and prices were fair. I would definitely go there again."
rn453991739,"Reviewed January 22, 2017 ", Rawai,COCONUT Bar & Restaurant - Rawai Beach,"Great bar tucked away from the main beach road. Atmosphere was good and the drinks were a decent price. Cocktails were great. The band was absoloutely amazing, especially the guy on the keyboard. Anyone have any idea of the bands name or the guy on...More"
rn452079136,"Reviewed January 15, 2017 ", Rawai,COCONUT Bar & Restaurant - Rawai Beach,We found the Thai food to be quite western. After travelling a bit around Thailand we have come to enjoy more authentic food. I would say this is not a bad thing if your new to the country or have small children to cater for....More
rn451678255,"Reviewed January 13, 2017 ", Rawai,COCONUT Bar & Restaurant - Rawai Beach,"Nothing special
Nice and clean
Waited along time for a standard starter 25 minutes for chicken liver pate and it was warm.
Pork chop , chips, salad and gravy .Very bland with crinkle cut chips,sorry not for me.My Wife had salmon fillet said it was...More"
rn451433623,"Reviewed January 12, 2017 ", Rawai,COCONUT Bar & Restaurant - Rawai Beach,"We have visited the Coconut Bar for many years, always enjoying the view of the street, the drinks and tasty fare. A busy place, we recommend this Bar as an enjoyable place to spend an evening."
rn450797652,"Reviewed January 9, 2017 ", Rawai,COCONUT Bar & Restaurant - Rawai Beach,"Popped in a few times but only for drinks at the bar. Friendly staff & wifi available.
Seemed popular for western food, we didn't eat but what was being served to others looked nice.
This bar is on the main road through Rawai Beach, opposite...More"
rn450625148,"Reviewed January 8, 2017 ", Rawai,COCONUT Bar & Restaurant - Rawai Beach,"We only got a delivery to our villa…good range of food, priced for the European market but really good option for a lazy night in!"
rn450588688,"Reviewed January 8, 2017 ", Rawai,COCONUT Bar & Restaurant - Rawai Beach,"Was recommended this place by our hotel and TripAdvisor excellence awards hang on the walls. With that said, we've had better Thai food in random places. It's not bad but not great. Pad Thai doesn't look or taste traditional. Prices standard for the area."
rn450085430,"Reviewed January 7, 2017 ", Rawai,COCONUT Bar & Restaurant - Rawai Beach,"My wife and i have dined at Coconut many times over the last 3 years. The food is always tasty and reasonably priced.
The staff have always been friendly and helpful. Coconut is our go to place in Rawai because they never let us down."
rn450072543,"Reviewed January 6, 2017 ", Rawai,COCONUT Bar & Restaurant - Rawai Beach,My bf and I come here often (2-3xs/wk). The staff is always friendly and polite. The customers they attract are great-no roudy loud people. It's very cozy and lovely. Foods good too...I love their crispy pork and kale dish. Yum!
rn448388779,"Reviewed January 1, 2017 ", Rawai,COCONUT Bar & Restaurant - Rawai Beach,We seem to be discovering some great new places down near Rawai beach. Even though we have been coming to Rawai for 5 years we just didn't get to the area for dinning. That's changed this year thank goodness. We still have our favourites here...More
rn445761749,"Reviewed December 20, 2016 ", Rawai,COCONUT Bar & Restaurant - Rawai Beach,"Coconut B&R sits on the opposite side of the road from tree-lined Rawei Beach. Coconut has an airy design and makes good use of thatch roofing and wood to create a warm, ""island"" feel. The front-of-house is very clean. There are at 4 LCDs showing...More"
rn444909458,"Reviewed December 17, 2016 ", Rawai,COCONUT Bar & Restaurant - Rawai Beach,Chicken massaman was great! Good service and clean. Wandering cat kept us company lol. Good prices too
rn443412480,"Reviewed December 10, 2016 ", Rawai,COCONUT Bar & Restaurant - Rawai Beach,Been here many times over the years and food always good. Sadly at the moment the current staff do not match. Twice in the last 2 weeks we have found the place to be devoid of atmosphere due to the surliness of the waiting staff...More
rn442640032,"Reviewed December 7, 2016 ", Rawai,COCONUT Bar & Restaurant - Rawai Beach,"The place in located in very nice location but last week no body was there no people and no atmosphere.
The staff look was not ready for the night season may be many staff was new.
Hope next time will be better.
Ill try again."
rn441460367,"Reviewed December 1, 2016 ", Rawai,COCONUT Bar & Restaurant - Rawai Beach,Sports bar with several televisions. Nice Thai food and English food. Friendly atmosphere and good service.
rn436026633,"Reviewed November 9, 2016 ", Rawai,COCONUT Bar & Restaurant - Rawai Beach,"This has to be the cleanest restaurant I've ever come across and not just in Thailand! Great location. Nice decor. Food, from what I tried was nice. Big screen TV was on but muted so no demerits on this one. The watermelon juice was a...More"
rn435718311,"Reviewed November 8, 2016 ", Rawai,COCONUT Bar & Restaurant - Rawai Beach,This Bar Restaurant is very close to Rawai Beach with views of sea and Fishermen/ sellers Loveless location. Quality of the European menu is excellent I.e Breakfast menu but also the Fish and Chips are very good quality
rn435530668,"Reviewed November 8, 2016 ", Rawai,COCONUT Bar & Restaurant - Rawai Beach,"This bar and restaurant is a must for GOOD FOOD and great staff,the owner Ken will always make you welcome and once you have eaten and drank there(the draft Tiger is cheap and excellent)you will keep returning,we like this place so much we travel from...More"
rn434451400,"Reviewed November 3, 2016 ", Rawai,COCONUT Bar & Restaurant - Rawai Beach,"Yu already see at the menu card that it is not an usual western or thai Restaurant, but that they have the knowhow how to do better. The two times I had been there I was very happy with the delisious food and service. Tha...More"
rn433101485,"Reviewed October 30, 2016 ", Rawai,COCONUT Bar & Restaurant - Rawai Beach,Nice place by the beach. Enjoy a dinner here or simply come for a beer or cocktail and watch some rugby.
rn432802558,"Reviewed October 29, 2016 ", Rawai,COCONUT Bar & Restaurant - Rawai Beach,"The food was delicious and the atmosphere great, the service was quick and the meals excellent, it was also near a Pokestop which was handy <f0><U+009F><U+0098><U+0080>"
rn432176009,"Reviewed October 27, 2016 ", Rawai,COCONUT Bar & Restaurant - Rawai Beach,"We ate here a few times during our stay...It was only a few minutes walk form our hotel Rawai Palm Beach Resort.
Good vibes, even during monsoon season it was still reasonbly busy. Good food and great Wifi- as at the hotel it was hit&miss....More"
rn431980230,"Reviewed October 26, 2016 ", Rawai,COCONUT Bar & Restaurant - Rawai Beach,They Show football and other sports. If you want to have a drink or two its perfect. Its next to the street so maybe a littlebit loud. The Food wasnt The Best. My Wife was realy dissappointed from The noodles. My meal was ok.
rn429027697,"Reviewed October 17, 2016 ", Rawai,COCONUT Bar & Restaurant - Rawai Beach,"I often end up here whether for breakfasts, drinks, snacks or dinner. It never lets you down. The food is always good no matter what you order, western or Thai, the service is good, and after a refurbished downstairs there is more space and much...More"
rn428996163,"Reviewed October 17, 2016 ", Rawai,COCONUT Bar & Restaurant - Rawai Beach,"We stopped here for a drink and stayed for tea which was delicious. Paper prawns,spring rolls,garlic pepper prawn and fish which was all well cooked and fresh. Staff very attentive and friendly, with a nice decor."
rn428601447,"Reviewed October 16, 2016 ", Rawai,COCONUT Bar & Restaurant - Rawai Beach,Breakfast lunch and dinner all catered for here or even bar snacks if peckish. Great place to drink draft beer and cocktails while watching varied sports channels if you wish
rn426269496,"Reviewed October 8, 2016 ", Rawai,COCONUT Bar & Restaurant - Rawai Beach,"I was not expecting a such small restaurant to be that good. They have a bar and tables for restaurant. The environment was nice with red lights decoration, the food was great and tasty and the mojito well loaded with alcohol. Highly recommend for dinner"
rn423798311,"Reviewed September 30, 2016 ", Rawai,COCONUT Bar & Restaurant - Rawai Beach,Great pad Thai and curries here. Yum. Quite busy when we were here but service was excellent and no long wait for food as you can in some places when it is busy.
rn421558809,"Reviewed September 23, 2016 ", Rawai,COCONUT Bar & Restaurant - Rawai Beach,We ordered take away food late at night- it was delivered very promptly and was all beautiful and full of flavour. Would definitely order again from here.
rn420709145,"Reviewed September 20, 2016 ", Rawai,COCONUT Bar & Restaurant - Rawai Beach,We enjoyed a very nice Thai meal here. Service was good and the meals were tasty. We also watched numerous rugby games. The staff were friendly and efficient.From upstairs the view over Rawai beach is really good.
rn417388842,"Reviewed September 12, 2016 ", Rawai,COCONUT Bar & Restaurant - Rawai Beach,Theeee best bar and resturant. The girls are extremely friendly and so helpful when are interacted with. Tip and Ken are amazing hosts and so welcoming.
rn414196091,"Reviewed September 3, 2016 ", Rawai,COCONUT Bar & Restaurant - Rawai Beach,"I went to this bar to watch Australian rugby league. I was greeted by rude bar girl asking me if I wanted to be serviced for money. I refused and left!
Beware do not go to this cheap rude bar!More"
rn407857524,"Reviewed August 20, 2016 ", Rawai,COCONUT Bar & Restaurant - Rawai Beach,"Place has a good location, two floors. Nice ""Asian style"" look
The food was good! We were a large group and ordered a lot of different dishes. And beg.! The coconut shake - best so far!)"
rn407449609,"Reviewed August 19, 2016 ", Rawai,COCONUT Bar & Restaurant - Rawai Beach,"Great spot to hang out for an afternoon of cheap tiger draft beer and good food. Have had Thai and western food here and both were tasty and reasonable. Comfortable, clean, friendly. Sports on TV, too."
rn400957337,"Reviewed August 3, 2016 ", Rawai,COCONUT Bar & Restaurant - Rawai Beach,"A great spot to watch the sport in the evenings. Everything from F1 to football. The menu is diverse and has some great food. The beers are reasonably priced and always cold.
When I return to Rawai, I will be sure to drop in again!"
rn398921654,"Reviewed July 29, 2016 ", Rawai,COCONUT Bar & Restaurant - Rawai Beach,"really good menu for all the family, something for everyone even our picky English kids and right on the main Rawai seafront road. Sells Draught lager too."
rn398637081,"Reviewed July 28, 2016 ", Rawai,COCONUT Bar & Restaurant - Rawai Beach,This place has great fruit shakes and offers all different types of food. The meals were large so we couldn't finish it all but it was delicious! It's right across from the amazing Rawai beach and has an upstairs area. We will be going back...More
rn397153497,"Reviewed July 25, 2016 ", Rawai,COCONUT Bar & Restaurant - Rawai Beach,The food was delicious and the atmosphere lovely upstairs' The kids loved this restaurant . Went there twice on our week stay in Rawai
rn396036040,"Reviewed July 23, 2016 ", Rawai,COCONUT Bar & Restaurant - Rawai Beach,I've given 5 stars because the bar/cafe was lovely as well as the service and the quick ordering/arrival of food. However........don't come here if you like bacon because this bacon tastes like fish. The eggs were over easy and made in a small pan so...More
rn386690006,"Reviewed June 27, 2016 ", Rawai,COCONUT Bar & Restaurant - Rawai Beach,"We were staying at the Coconut villas so had a meal delivered most days, although ate at the restaurant a couple of times. the food and the service was terrific, every time."
rn383575783,"Reviewed June 17, 2016 ", Rawai,COCONUT Bar & Restaurant - Rawai Beach,"After all the great reviews I had higher expectations. Perhaps I got unlucky. I ordered massaman curry (of which I have eaten hundreds in Thailand and made many of my own.) It only had undercooked potatoes, mushrooms and peanuts in the sauce which was very...More"
rn383564118,"Reviewed June 17, 2016 ", Rawai,COCONUT Bar & Restaurant - Rawai Beach,"At the coconut bar and restaurant.. Nice place and friendly staff, sea view, beautiful beach relaxed with lovely song."
rn382718572,"Reviewed June 15, 2016 ", Rawai,COCONUT Bar & Restaurant - Rawai Beach,Stopped here for lunch. I got the duck red curry and my wife got the chicken panang curry. The red curry was nice and flavoursome. The panang was spicy and once you tasted it you keep going back for more. Restaurant and bar are very...More
rn379258706,"Reviewed June 3, 2016 ", Rawai,COCONUT Bar & Restaurant - Rawai Beach,We had one of our best dinners in Thailand at this place. The portions are good enough to satiate a ravenously hungry person. Ingredients are all fresh and high quality. Cooking is impeccable. And that little hut on a long road across the beach beckons...More
rn379245994,"Reviewed June 2, 2016 ", Rawai,COCONUT Bar & Restaurant - Rawai Beach,"Friendly, clean bar/restaurant. Visited every day for food during the holiday. The staff make this place and are always cheerful and very welcoming. Thank you."
rn378509636,"Reviewed June 1, 2016 ", Rawai,COCONUT Bar & Restaurant - Rawai Beach,"The first place I called into eat during my stay in the area. Nice staff, great food for a good price. It's in a great location and had a good relaxed atmosphere"
rn376426929,"Reviewed May 25, 2016 ", Rawai,COCONUT Bar & Restaurant - Rawai Beach,"Love this place, food fantastic... Spinach quiche to die for! A belly buster and soooo tasty. A menu for all tastes freshly cooked good ambiance and a lovely view day or night over Rawai beach...<f0><U+009F><U+0098><U+0098>"
rn375059691,"Reviewed May 21, 2016 ", Rawai,COCONUT Bar & Restaurant - Rawai Beach,"Loved this restaurant for its breakfasts, although its full menu was good as well. Staff were very helpful and friendly. We ate here quite a few times during our stay."
rn581181959,Reviewed yesterday , Patong,3 Spices Restaurant,The food was average my other half ask for something but mild and they brought it spicy. The place was nice... It was a bit too expensive
rn580277719,Reviewed 6 days ago , Patong,3 Spices Restaurant,"nice meal, cocktails were not great but standard of food was excellent and good value, good thai food"
rn574824190,Reviewed 4 weeks ago , Patong,3 Spices Restaurant,"We tried a lot of different Thai resturants during our stay and hands down was the best food we had.
Staff were attentive and cost was pretty good compared to other restaurants.More"
rn570500865,"Reviewed April 2, 2018 ", Patong,3 Spices Restaurant,"The food is really nice, but the staff seem a bit stressed. Seems there was to few waiters for the number of guests. Great value for money.More"
rn569846380,"Reviewed March 31, 2018 ", Patong,3 Spices Restaurant,Probably one of the yummiest Thai I have ever had food was tasty price was reasonable very happy with our meal we will be back!More
rn566032211,"Reviewed March 12, 2018 ", Patong,3 Spices Restaurant,"Great drinks, amazing food and lovely service! Will not be disappointed! Our fave restaurant in Phuket!More"
rn565562847,"Reviewed March 9, 2018 ", Patong,3 Spices Restaurant,We had dinner at 3 spice and the food was very tasty and authentic. The service was friendly and efficient. We loved the green curry and the crispy pork belly. Will be definitely back in future! It is also a great spot to overlook the...More
rn561532305,"Reviewed February 19, 2018 ", Patong,3 Spices Restaurant,We tried the set menu on offer thou there were loads of selections from the A La Carte menu. Really good food for the price paid. Decent portion which we liked. Try and you won't be disappointed.More
rn560410285,"Reviewed February 14, 2018 ", Patong,3 Spices Restaurant,Hit or miss... Explains the contrast of reviews. We ate here during the day and there was a man cooking; the food was really good and flavorful. That's why we decided to eat here again the next day but at night time. That was a...More
rn555063755,"Reviewed January 20, 2018 ", Patong,3 Spices Restaurant,"I have walked by this restaurant many times, and decided to give it a try.
I was not disappointed with the food and the attention to detail service. Kung was our server, she made us feel very comfortable.
The sea bass was delicious, and the...More"
rn554178256,"Reviewed January 16, 2018 ", Patong,3 Spices Restaurant,"We were tired and took the first restaurant we seen. I had a duck stir fry, it was great... my husband loved his beef stir fry. So it was a good choice. We will be back before we head out."
rn551984655,"Reviewed January 6, 2018 ", Patong,3 Spices Restaurant,Very happy with the food! We had an entree and shared two mains! we left feeling very full and very satisfied! It was a great final meal in ThailandMore
rn551182562,"Reviewed January 3, 2018 ", Patong,3 Spices Restaurant,"3 Spices is one of two more expensive / higher end restaurants very close to Patong beach and just like the other one (see one of my other recent reviews), it doesn't disappoint.
It's on the main road just after the beach ends so the...More"
rn550763098,"Reviewed January 1, 2018 ", Patong,3 Spices Restaurant,"Really had high expectations when we arrived. Restaurant looked modern and new and had a great menu. But sadly we were quite disappointed.
Ultimately the food was just bland. The satay had zero flavor. Our king prawn with tamarind sauce seemed to be missing the...More"
