ID,Review Date,Location,Hotel/Restaurant name,Review
rn403247033,"Reviewed August 9, 2016 ", Patong,Cafe 101 Bar & Restaurant,"This bistro restaurant served good Thai food at a reasonable prioce. The food presentation was awesome. The downsize is the waitors don't speak much english, I had expected them to be above average seeing the 101 calls itself ""international"". Great place to eat nevertheless!More"
rn402449249,"Reviewed August 7, 2016 ", Patong,Cafe 101 Bar & Restaurant,"European & Thai food. Indoor & outdoor seating, Big servings, reasonable pricing.
Note that the restaurant Urban Food nearby is linked, has the same menu but is nicer inside. Also the pizza's are prepared at Urban Food and walked across to Cafe 101 to be...More"
rn401897637,"Reviewed August 5, 2016 ", Patong,Cafe 101 Bar & Restaurant,We eaten here many times. The only problem I have with this restaurant are the little cockroaches that sometimes show up if you sit in the seats near the wall behind the pizza oven. I don't understand why they don't spray the area with raid....More
rn398328096,"Reviewed July 28, 2016 ", Patong,Cafe 101 Bar & Restaurant,"Setting: We (two adults and two kids) were there for lunch on a rainy weekday.
Drinks: Berry smoothies tastes like bubble gum (not kidding). The other smoothies tastes like very poor bottled juice blended with ice. Order something bottled instead (cola, beer).
Food: Panini not...More"
rn397769131,"Reviewed July 26, 2016 ", Patong,Cafe 101 Bar & Restaurant,"my husband and i ate here for dinner we ordered a whole chicken and salad with veges to share the salad average the veges the same i ate a small piece of the bbq chicken and within 5 mins was running to the toilet,im lucky...More"
rn396102901,"Reviewed July 24, 2016 ", Patong,Cafe 101 Bar & Restaurant,A small cafe in the heart of Jungceylon. Friendly service with an abundance of food choices. Food is very well priced and very tasty!More
rn391585833,"Reviewed July 11, 2016 ", Patong,Cafe 101 Bar & Restaurant,We waited for 30 mins for the first dish which had to be returned as it was way too salty. The second dish was also salty and took a further 10 mins to turn up. The 3rd dish which would have been by far the...More
rn387466297,"Reviewed June 29, 2016 ", Patong,Cafe 101 Bar & Restaurant,Me and my husband ate lunch here. He ordered lasagne and me burger. The food came from two different kitchens. His food came probably after 10 minutes waiting and mine never came. When we asked the young waiter he said my burger was one the...More
rn385714656,"Reviewed June 24, 2016 ", Patong,Cafe 101 Bar & Restaurant,"They serve delicious foods with a lot of good servers , waiters were polite and do everything you want.More"
rn379398430,"Reviewed June 3, 2016 ", Patong,Cafe 101 Bar & Restaurant,Forget the Thai menu in this place but absolutely recommend The rotisserie chicken. esp the Thai style marinate. Soooo good! Not spicy at all so it's great for the not so adventurest. the flavor is just right and the chicken texture is moist and tasty....More
rn376900766,"Reviewed May 26, 2016 ", Patong,Cafe 101 Bar & Restaurant,"Had lunch there a few times. Enjoyed the food, good portions and not expensive.
The staff were vwey friendly and on the ball.
Overall a nice eating experience."
rn373583739,"Reviewed May 16, 2016 ", Patong,Cafe 101 Bar & Restaurant,Went to dinner at 101 whilst visiting Jungceylon the staff were attentive and friendly and the premises was clean and tidy the food was plentiful but seemed to be lacking in ingredients the dish I ordered consisted mainly of noodles and not much else and...More
rn372205079,"Reviewed May 11, 2016 ", Patong,Cafe 101 Bar & Restaurant,"We found the food, location, staff and the cost of our meals to be great overall. We would second our son's recommendation and suggest tourists consider having a meal there. It's located in the mall at the JungCeylon centre near the Irish Times pub."
rn369541854,"Reviewed May 2, 2016 ", Patong,Cafe 101 Bar & Restaurant,"On the hunt for lunch my family and I decided to stop in here as it looked modern and inviting and the photos on menu looked tasty...however that's where it stopped. We all ordered Thai dishes and besides the portion sizes being small, not one...More"
rn365969078,"Reviewed April 21, 2016 ", Patong,Cafe 101 Bar & Restaurant,"On our last trip to Patong (March16), we tried the Cafe 101 and it was exellent. I've tried the Salad (Big bowl), Pizza (thin and crispy), Pasta and garlic bread. The Food is delicious and served in big portions. Friendly Staff. Nice decor, i really...More"
rn364507328,"Reviewed April 15, 2016 ", Patong,Cafe 101 Bar & Restaurant,"I thought the 2 female staff here were horrible, there was a mix up in our order and she scolded me after I explained to her that the food she brought me was not what I had ordered. During my meal they also had a...More"
rn362280807,"Reviewed April 7, 2016 ", Patong,Cafe 101 Bar & Restaurant,"We ate here four years ago and walked away loving every bite, so this time we thought we would come back for some more amazing food.
How disappointing, the food not the same, a complete let down : (
The staff are very friendly and...More"
rn362163558,"Reviewed April 6, 2016 ", Patong,Cafe 101 Bar & Restaurant,We have tried Kitchen located 5 minutes from Jungceylon before trying Cafe 101. Both Cafe 101 and Kitchen belong to the same owner according to the waiters. They share the same menu and the prices of the food and drinks are exactly the same as...More
rn361187082,"Reviewed April 3, 2016 ", Patong,Cafe 101 Bar & Restaurant,"In the heart of a huge commercial center, surrounded by other restaurants, 101 looks modern, funny and well prepared. Food cooked from all over the world and Thai as well. But portions are drastically small, not tasty at all, and much expensive than the average...More"
rn359704080,"Reviewed March 29, 2016 ", Patong,Cafe 101 Bar & Restaurant,Food presented different from how it was advertised. Poor quality on the food. Crew ok. Not recommended. Spend your money somewhere else!
rn357855481,"Reviewed March 23, 2016 ", Patong,Cafe 101 Bar & Restaurant,While we were in Patong we decided to go there for lunch. Unfortunately its one of those restaurants were staff juat want to take your order and move on. No greetings or any smiles. We placed our order and food was on our table in...More
rn353797395,"Reviewed March 8, 2016 ", Patong,Cafe 101 Bar & Restaurant,"Had late lunch/early dinner here. We both ordered beef red curry, asked for it to be spicy. The beef was tender, but hardly any gravy, and not spicy at all. We got one small portion of rice to share (we didn't order rice, presumed it...More"
rn351373744,"Reviewed February 27, 2016 ", Patong,Cafe 101 Bar & Restaurant,"Was there with my girlfriend. Actually french consorts gets a special care (special plates, special lunch menu) and the worst thing, the boss sits their special guests (family with teenage child) next to us. No discretion. MAQNIFIQUE!! Never ever..More"
rn350014456,"Reviewed February 22, 2016 ", Patong,Cafe 101 Bar & Restaurant,We have been to this restaurant many times before. Just arrived in patong today and decided to go for dinner we both ordered half a roast chicken med style the chicken was varely warm the gravy was stone cold the only thing hot was our...More
rn349630182,"Reviewed February 21, 2016 ", Patong,Cafe 101 Bar & Restaurant,"Very good meal, we both had curries one Red Beef and one Red Duck, lucky to get a table as a very busy restaurant."
rn348928859,"Reviewed February 18, 2016 ", Patong,Cafe 101 Bar & Restaurant,"A good place for lunch and dinner, nothing special but still good and with midrange prices. good location inside jungceylon shopping mall"
rn341357968,"Reviewed January 20, 2016 ", Patong,Cafe 101 Bar & Restaurant,Restaurant loojed pretty empty. Ordered a bowl of soup and calamari. Checked after 30 mins on when the food was coming. Waiter said 10 more mins. Checked again 15 mins later with another waiter. She checked and said our order wasn't in and asked us...More
rn338846887,"Reviewed January 10, 2016 ", Patong,Cafe 101 Bar & Restaurant,"Awesome price, tasty food, great staffs.
Like the idea of combining both local food, Asian food and western food.
Ordered the tomato soup, chicken rosti, spaghetti bolognese, tom yam soup.
Unlike the regular thai portion, those here are bigger in portion... And tasted good"
rn338590552,"Reviewed January 8, 2016 ", Patong,Cafe 101 Bar & Restaurant,Food was average at best. There are certainly better places to dine at Jungceylon. Usually when your seated inside you'd expect to be in air conditioned comfort.... Service was good and fast price was reasonableMore
rn337735585,"Reviewed January 5, 2016 ", Patong,Cafe 101 Bar & Restaurant,"Great choice of food in a cosy ambiance. The staff is super friendly and Alain, the manager is professional. The price range is absolutely affordable for any budget. the menu is well filled so no problem to go several times without having to eat twice...More"
rn555423552,"Reviewed January 22, 2018 ", Karon,Bob's Restaurant & Bar,"Funny guys work, making good cocktails, you can enjoy Board games, Billiards , great music and tastes amazing surroundings."
rn555410530,"Reviewed January 22, 2018 ", Karon,Bob's Restaurant & Bar,"Here you have a rasta inspired place. There is decent food, not good service and the owner is just ignorant when you try to point out that everything was wrong or incomplete on your order....but they had good rasta music."
rn554483275,"Reviewed January 17, 2018 ", Karon,Bob's Restaurant & Bar,Hope you like reggae music as it is non stop. Service was o.k had a big group and some things got confused.Food was good and drinks cold. Heaps of variety.
rn550194760,"Reviewed December 30, 2017 ", Karon,Bob's Restaurant & Bar,"You dont expect such great food in a reggae bar but WOW a great location with a sunset, very chilled vibe and fantastic Thai food and plenty for the kids"
rn546938492,"Reviewed December 12, 2017 ", Karon,Bob's Restaurant & Bar,".
Great staff up for fundidn't eat here but had a few cocktails after dinner elsewhere.
A caribbean bar in a Thai resort strange but somehow it worked."
rn543772810,"Reviewed November 28, 2017 ", Karon,Bob's Restaurant & Bar,Lobster Thermdor was great. My whole ' white snapper ' was Barramundi though - nice sauce but didn't like the fish. Everything else we ate was great. Music is good but wish they would play some new Reggae like Chronnix. still....a groovy spot man
rn543278138,"Reviewed November 25, 2017 ", Karon,Bob's Restaurant & Bar,"This little bar caught our eye on arrival & we visited twice. Both times all the boys working in the bar were great fun & the bars puppy Soda, we want to take him home! Chilled Reggae music playing along with nice lighting."
rn541019443,"Reviewed November 14, 2017 ", Karon,Bob's Restaurant & Bar,"Had dinner and lunch here several times, its right on the beach front and so casual and relaxing. Great staff and massive menu to cater for everyone. Perfect place to sit with a cold drink and watch that impressive Sun go Down. love the Regae...More"
rn536742805,"Reviewed October 28, 2017 ", Karon,Bob's Restaurant & Bar,Bob's is an institution in Kamala. Great spot on the beach with reasonably priced food and drinks. Feel the reggae beat and watch the sun go down. Recommended.
rn480134687,"Reviewed April 30, 2017 ", Karon,Bob's Restaurant & Bar,This was a cool place to sit on Kamala Beach and watch the world go by. Plenty of staff on standby. Good selection of drinks at reasonable prices. Food looked a bit pricey so ate elsewhere.
rn476013780,"Reviewed April 16, 2017 ", Karon,Bob's Restaurant & Bar,Really enjoyed having a few beers and playing some games at this makeshift bar. Staff all very friendly. Only issue was that they never seemed to be serving food. A bit strange to see a full-sized snooker table in there as well. Definitely worth a...More
rn469121355,"Reviewed March 21, 2017 ", Karon,Bob's Restaurant & Bar,"Great easy to unwind kind of bar.. ..the lads work exceptionally hard to make you happy very friendly, good food, great cocktails (mai tai) and old beer"
rn464830305,"Reviewed March 5, 2017 ", Karon,Bob's Restaurant & Bar,Great location just off the beach! Didnt have anything to eat here but had a few cocktails which were awesome at reasonable prices. Staff were friendly. nice chilled music playing x
rn463622585,"Reviewed February 28, 2017 ", Karon,Bob's Restaurant & Bar,"Nice! Friendly staff, nice soft music... Bob Marley style. Beautiful location right on the waterside by the beach."
rn459585201,"Reviewed February 14, 2017 ", Karon,Bob's Restaurant & Bar,Bar and restaurant. Excellent food - a touch different and better. Very good menu. Even the steaks are good. Good measures with drinks.
rn455898244,"Reviewed January 30, 2017 ", Karon,Bob's Restaurant & Bar,"Went originally for a drink as its a good venue and reggie bar. Very reasonable prices and if you get peckish good place to settle for a good meal at very good prices
you won't go far wrong for a great evening"
rn446013586,"Reviewed December 21, 2016 ", Karon,Bob's Restaurant & Bar,"On the beach front with a very cool vibe and excellent Thai food,all ages catered for even the kids love it"
rn445173617,"Reviewed December 19, 2016 ", Karon,Bob's Restaurant & Bar,"Nice bar/ restaurant with very friendly staff. You can play pool, borrow something to sit on at the beach, have a bite and just enjoy Kamala beach. Of course the only music you hear is reggae <3"
rn441646230,"Reviewed December 2, 2016 ", Karon,Bob's Restaurant & Bar,"Bobs bar is a good start point when doing the beach walk. The staff are friendly, even hand you mozzie repellent, and good reggae sounds"
rn432568308,"Reviewed October 28, 2016 ", Karon,Bob's Restaurant & Bar,"Popped into the Bar at Lunchtime and stayed until the early hours.. staff were amazing! We laughed we joked and enjoyed the food, beer, shots and music.. well worth the visit.
I will always go back for more"
rn426825263,"Reviewed October 10, 2016 ", Karon,Bob's Restaurant & Bar,"Visited here in early October a few nights into our holiday. My husband and I shared fish cakes (luckily our son didn't have any) and had other mains and we both fell ill from quite severe food poisoning.
I obviously wouldn't recommend going here."
rn372520379,"Reviewed May 13, 2016 ", Karon,Bob's Restaurant & Bar,"Came here for lunch with another couple we met at our hotel. Nice, relaxed vibe. We got an assortment of food including spring rolls, garlic bread, tom yum soup, and sandwiches - all washed down with a few beers.
Food was good - had an...More"
rn366329983,"Reviewed April 22, 2016 ", Karon,Bob's Restaurant & Bar,Great people and reasonably priced! The staff were so good with our little boy. They saw us coming every night and lay down a mat with toys for him while we had a beer. Went back several times and will go back again. When we...More
rn365837756,"Reviewed April 20, 2016 ", Karon,Bob's Restaurant & Bar,"A few drinks in Bobs bar, after a meal in a Kamala beach restaurant, has been s tradition of ours for several years. But sadly this year the bar is lacking energy and has lost its way. This is a real shame as we always...More"
rn365112483,"Reviewed April 18, 2016 ", Karon,Bob's Restaurant & Bar,"This amazing place is not just amazing because of its location (beachside) but also because of it's great staff (friendly, smiling, tactfull, helpfull, polite..... etc...), nice food and drinks as well as clean WC, free wifi ...."
rn358085425,"Reviewed March 24, 2016 ", Karon,Bob's Restaurant & Bar,"This is the most relaxing, nice, well situated place in Kamala. This is where you can have good food, good drinks and at the same time sit on the front to the most beautiful view, listen to the best music, nonstop. The staff is very...More"
rn344954529,"Reviewed February 4, 2016 ", Karon,Bob's Restaurant & Bar,"Simple and norrmal prices for nice food, nice music , by the beach, friendly staff.
We went to Kamala beach many times and we prefered this restaurant for food and drinks and it totally worths."
rn342959774,"Reviewed January 26, 2016 ", Karon,Bob's Restaurant & Bar,"Great place this! On the beach, great atmosphere even when it's empty due to its setting. The staff are very swift yet in a friendly way.
Connect Four (4 in a row) sets available for playing whilst you sit and wait or just chilling with...More"
rn342395418,"Reviewed January 24, 2016 ", Karon,Bob's Restaurant & Bar,"The host was very friendly, as were all of the staff. I was almost embarassed that they all remembered my name, but I couldn't remember all of theirs whether it be in the restaurant or running into one about town. I ate breakfast (fruit plate),...More"
rn341553230,"Reviewed January 20, 2016 ", Karon,Bob's Restaurant & Bar,Came here to chill out and wait for a friend who was getting a massage at another spot. WiFi wasn't working at the time and cocktails were incredibly small. However staff were accommodating with song requests and a game of pool was only 20 baht....More
rn341008603,"Reviewed January 18, 2016 ", Karon,Bob's Restaurant & Bar,"This was the first stop for dinner for us on our first night in Kamala, & it became our ""local' place to go!!! We ate here twice in our week, both times very good, & then just popped in most nights for an after dinner...More"
rn340351352,"Reviewed January 15, 2016 ", Karon,Bob's Restaurant & Bar,"Great people watching place! They have games like Jenga and Connect Four you can play while you sit. Great service, good drinks and good food!"
rn339583019,"Reviewed January 13, 2016 ", Karon,Bob's Restaurant & Bar,"After a four week long trip in Thailand this is the only place to actually mess up a Pad Thai. It was swimming in some weird sauce. Sent it back.
The grilled sandwich toast is exactly just that - white toast with a slice of...More"
rn337958024,"Reviewed January 6, 2016 ", Karon,Bob's Restaurant & Bar,"Thos resturamt was the best I ever visited on my vacation in Kamala beach. Its located right by the beach so during day time you will have a beautiful view over the beach and the clear blue water, and by night u can hear the...More"
rn336144551,"Reviewed December 30, 2015 ", Karon,Bob's Restaurant & Bar,"We had lunch here twice during our recent trip and beers on a third visit. There are a number of beach dining options and I expect they are all pretty similar, but found the food here to be as good as any other meals we...More"
rn326118313,"Reviewed November 11, 2015 ", Karon,Bob's Restaurant & Bar,Really enjoyed this bar. So chilled out and relaxed. Lots to keep you entertained as well. The staff were really friendly and the food was pretty good. Went back a second time for food and drinks!
rn325212528,"Reviewed November 8, 2015 ", Karon,Bob's Restaurant & Bar,"Unworthy of even being 41 out of 100 restaurants in Kamala.
Ordered garlic bread and bruschetta to start; seafood basket, chicken basket and kebab for mains.
Bruschetta - came first. Basically was chopped tomato on stale bread.
Garlic bread - arrived a good ten mins...More"
rn323539837,"Reviewed October 31, 2015 ", Karon,Bob's Restaurant & Bar,We found Bobs to have a great atmosphere and nice staff. Prices are a bit more expensive and they don't seem to have same happy hour as others nearby. Didn't eat here but stopped several times for a beer and to listen to reggae.
rn264522260,"Reviewed April 8, 2015 ", Karon,Bob's Restaurant & Bar,"Love the food served at Bob's bar is very good and then it gets no worse of all reggae played through the speakers:-) , we will be back next time we coming to Kamala"
rn264390063,"Reviewed April 8, 2015 ", Karon,Bob's Restaurant & Bar,"If you want a beer by the beach then this is great.
Chilled Bob Marley music playing as you drink.
If it's decent food then I'm afraid Bob falls short of the mark.
I'd prefer hitting the local Thai shops for Thai food.
But if...More"
rn264057588,"Reviewed April 6, 2015 ", Karon,Bob's Restaurant & Bar,The chilled and relaxed atmosphere make Bobs Bar the ideal place to finish your night after eating in one of the local beachfront Thai restaurants. The staff are really friendly and attentive. We have been to Bobs Bar on previous visits to Kamala and always...More
rn263064913,"Reviewed April 1, 2015 ", Karon,Bob's Restaurant & Bar,"It should have been somewhat incongruous - a homage to Bob Marley and all things Caribbean on a beach in Thailand. But, somehow it works. The bar was busy, the music great, service friendly and attentive and the food very good and inexpensive. Not you...More"
rn255922357,"Reviewed February 22, 2015 ", Karon,Bob's Restaurant & Bar,"We enjoyed a lovely meal at Bob's on a recent trip to Kamala. Great position on the beach, chilled reggae beats and a beautiful sunset to match. The staff were very friendly and helpful, particularly for our two year old son who had a great...More"
rn254931724,"Reviewed February 18, 2015 ", Karon,Bob's Restaurant & Bar,"Some people you know they dont believe, thailand has a bobsleigh team..cool place...Great place to chill out on kamala beach , nice cool breeze off the sea, cold beers and friendly service...perfect place to chill at sunset with some reggae tunes playing..peace be da journey"
rn253143660,"Reviewed February 8, 2015 ", Karon,Bob's Restaurant & Bar,"Went to this bar and restaurant last night. On the beach, lively with music. Lots of games for children and a pool table. Good meals and price,750 baht with drinks for 2"
rn250928406,"Reviewed January 25, 2015 ", Karon,Bob's Restaurant & Bar,"We came here every day for a drink and enjoyed the relaxed atmosphere and beautiful views. The drinks are reasonably priced and they have a great cocktail menu and the staff are really friendly.
We contemplated eating here because the food we saw looked and...More"
rn250114135,"Reviewed January 19, 2015 ", Karon,Bob's Restaurant & Bar,"The atmosphere was nice and relaxed, and the view of the beach very nice. The thai food was quite basic though. Worth a visit."
rn248595345,"Reviewed January 10, 2015 ", Karon,Bob's Restaurant & Bar,"We spent many an evening at this lovely Restuarant and Bar. The staff are lovely and friendly, our daughter was made so welcome and was very fond of the place :). They have a few mats set up with toys to entertain the little ones,...More"
rn246050279,"Reviewed December 27, 2014 ", Karon,Bob's Restaurant & Bar,"We went here on Christmas day for something totally different. We played billards and table soccer, had nice cocktails and listened to great music. Food was below Phuket average, but ok. The kids really enjoyed and it was a fun evening"
rn245910123,"Reviewed December 26, 2014 ", Karon,Bob's Restaurant & Bar,"Of all the places on Kamala beach front this place is great. Don't be turned off if you are not a reggae fan. The good is great, the staff really friendly and the prices good.
Loved the whole fish fried and streamed. Wow."
rn244493327,"Reviewed December 14, 2014 ", Karon,Bob's Restaurant & Bar,Great bar right on the beach. Staff are very friendly and the food was tasty. Cocktails nice and fresh. This is one of the best places to visit in Kamala. They have beach mats you can borrow and they bring drinks down onto the beach...More
rn240251038,"Reviewed November 17, 2014 ", Karon,Bob's Restaurant & Bar,"The bar is located at the end of the lines of bars and restaurants at the beach. Therefore it is not as crowded and a much more peaceful part of the beach. It is a great place to watch the sunset.
The food is ok...More"
rn240193987,"Reviewed November 17, 2014 ", Karon,Bob's Restaurant & Bar,"Looking for a fun night out? Go visit Bob at the Bob (Marley)'s bar. Prices are fair, toilet is clean, fun games incl pool table and the service are superb! A must-visit if you are in the area!"
rn237536736,"Reviewed November 2, 2014 ", Karon,Bob's Restaurant & Bar,The range and price of food was excellent. The atmosphere - Bob Marley - was fun and the memorabilia were well chosen. A great place for a dinner to see a beautiful sunset over the water.
rn226535306,"Reviewed September 2, 2014 ", Karon,Bob's Restaurant & Bar,"The food was over priced and poor quality when delivered. I ordered calamari and when it arrived it was only luke warm. When I told them, they asked me if I wanted it hot. Pleasant staff and many of them but if it didn't have...More"
rn226139658,"Reviewed September 1, 2014 ", Karon,Bob's Restaurant & Bar,"At Bob's bar you can have a drink and a meal, I recommend that you go from 4 til 7 happy hour 2 for one drinks, get merry and eat and watch the sunset in the west amazing."
rn214847823,"Reviewed July 11, 2014 ", Karon,Bob's Restaurant & Bar,Lovely restaurant situated on the beach. The breakfast served was prompt and very nice banana pancakes. The atmosphere is very cute/homely. I was told by others (visitors) that the lobster served at Bob's restaurant is amazing! Reading comments below is stated the cocktails are bad...More
rn188563662,"Reviewed December 26, 2013 ", Karon,Bob's Restaurant & Bar,My friends and I stumbled across this place late at night while taking a scooter ride from Patong. We liked the relaxed music (bob Marley of course!) so we sat down and ordered some booze. The piña coladas served in the coconut where to die...More
rn186981697,"Reviewed December 7, 2013 ", Karon,Bob's Restaurant & Bar,"Please do not go to this bar as the little man was rude and did not care if your food was not good , only thai person I have ever seen be rude to anyone stay away unless you like to be spoken to like...More"
