ID,Review Date,Location,Hotel/Restaurant name,Review
rn579215972,Reviewed 1 week ago , Kata Beach,Chai Thaifood Restaurant,"Great food and service highly recommended and reasonable value.
Staff friendly and owner very funny."
rn578703468,Reviewed 1 week ago , Kata Beach,Chai Thaifood Restaurant,"Saw reviews on TripAdvisor so decided to pop in for lunch. We got the chicken pad thai (<U+0E3F>80) and the papaya salad (<U+0E3F>80)- which, for the first time, the papaya salad came with prawns that did not cost extra- and both were very fresh and...More"
rn578415500,Reviewed 2 weeks ago , Kata Beach,Chai Thaifood Restaurant,"Just a heads up Mr. Wanchai has another restaurant down the same street called E Saan, so if you go there and notice the menu is exactly identical to Chai Thaifood don't be alarmed! Both places are lovely with attentive service but my preference goes...More"
rn574551339,Reviewed 4 weeks ago , Kata Beach,Chai Thaifood Restaurant,I would not have gone here if it had not been for the reviews on trip adviser. This little restaurant was right on the door step of our accommodation so we thought we would try it. The service is a bit hap hazard but the...More
rn569871924,"Reviewed March 31, 2018 ", Kata Beach,Chai Thaifood Restaurant,"We had lunch here was a nice and friendly place, not the best but not the worst. I'd go back again however there's plenty to try in Kata so I won't be rushing back."
rn568815841,"Reviewed March 26, 2018 ", Kata Beach,Chai Thaifood Restaurant,We popped in for a quick lunch shortly after arriving on Phuket via fast ferry. We were hungry and tired from the heat. We ordered three dishes all of which were tasty and nicely presented. And some nice soda water. The staff were very pleasant...More
rn562230921,"Reviewed February 22, 2018 ", Kata Beach,Chai Thaifood Restaurant,"very good restaurant the best of kata and any phuket, hard to find better. Unbeatable value for money! Very friendly and welcoming team. See you soon..."
rn530605555,"Reviewed October 6, 2017 ", Kata Beach,Chai Thaifood Restaurant,"8 out of 10 this restaurant delivery top top top top class food. Really Really excellent. The other 2 -10 is around normal. But trust me, when they delivery its like world class. And to the owners, I am not talking about midium or spicy...More"
rn524307242,"Reviewed September 14, 2017 ", Kata Beach,Chai Thaifood Restaurant,Great food in quantity and quality.Cheeky staff who love to have a good laugh but supply great sevice.
rn515158752,"Reviewed August 19, 2017 ", Kata Beach,Chai Thaifood Restaurant,"This was one of the worst meals we have had in Thailand. The chicken satay was not cooked through, the green curry was not authentic and the garlic pepper stirfry was over cooked and dry. Very disappointing, considering in May last year the food was...More"
rn514279535,"Reviewed August 17, 2017 ", Kata Beach,Chai Thaifood Restaurant,This place was recommended to us and having tried so many different places it made sense to try another even though it was a tuktuk ride away. The welcome was warm and friendly and it had a nice local feel to it. The food was...More
rn509340192,"Reviewed August 6, 2017 ", Kata Beach,Chai Thaifood Restaurant,We had pad Thai and masaman curry and they were delicious. The staff was really friendly and the owner walked around asking and making sure everything was fine. We will definitely repeat.
rn503169809,"Reviewed July 18, 2017 ", Kata Beach,Chai Thaifood Restaurant,"This is the best Thai food restaurant we ever visited. The personnel is friendly, the restaurant owner is engaging. Thai food is delicious, especially Pad Thai. Surely we'll come back to this place."
rn491993885,"Reviewed June 10, 2017 ", Kata Beach,Chai Thaifood Restaurant,"Stumbled upon Chai Thai due to The Family Restaurant being closed, which is close by. I must say we were happy it was closed, the food here was absolutely amazing. The Phad Gra Prao was possibly the best I've ever had and I've had this...More"
rn484068322,"Reviewed May 14, 2017 ", Kata Beach,Chai Thaifood Restaurant,"This is a great restaurant!
The food is really good AND affordable for Kuta.
My boyfriend had a pad Thai + 2 fries eggs and I had the pineapple fried rice with shrimps. Both meals were excellent!
In total, it costs us 260bath.
Finally, The...More"
rn476973817,"Reviewed April 18, 2017 ", Kata Beach,Chai Thaifood Restaurant,The owner is really friendly and helpful. We ate way too much though thanks to the delicious food. We can recommend the papaya salad.
rn472269598,"Reviewed April 2, 2017 ", Kata Beach,Chai Thaifood Restaurant,I've eaten here many times. Tasty cheap food and great service. Mr Chai is very friendly as chats with all the customers. Thoroughly recommend if you're in kata beach.
rn471752957,"Reviewed March 31, 2017 ", Kata Beach,Chai Thaifood Restaurant,"If your not up for street food but want an authentic thai dinner then this is the place for you ! Very busy so you know the food is fresh , all the favourites like special thai rice in pineapple and Penang prawn curry !...More"
rn471644340,"Reviewed March 31, 2017 ", Kata Beach,Chai Thaifood Restaurant,"This raodside restaurant is sooo busy all the time, we decided we had to give it a try. We were not disappointed, as the food was good , although not all the dishes came out together! It's very reasonably priced for both the food &...More"
rn470850119,"Reviewed March 28, 2017 ", Kata Beach,Chai Thaifood Restaurant,We were actually on our way to one of the places we found on trip advisor but walking past this place we had to stop. There were lots of people in here-most were Thai. If it hadn't been for the people we probably would of...More
rn470636161,"Reviewed March 27, 2017 ", Kata Beach,Chai Thaifood Restaurant,"Don't be put off by the ""cafe"" look and feel of this place, the food was probably the best we had in Kata and we tried quite a few places!
Amazing value, once we found it we kept going back. The currys are amazing and...More"
rn469253652,"Reviewed March 21, 2017 ", Kata Beach,Chai Thaifood Restaurant,"We have just spent 10 days in Kata, and dined out at Chai Thai on several occasions. The food is simple but nice.
Chai & his friendly staff provide great service & we will return to this restaurant again."
rn461118572,"Reviewed February 19, 2017 ", Kata Beach,Chai Thaifood Restaurant,"The owner opened the restaurant to mainly cater for the tastes of Chinese, Korean, Japanese and other far eastern countries,
Hence the menu of Thai dishes but with very little or no chillies.
They will prepare with spice if required, just ask.
We visited a...More"
rn459877366,"Reviewed February 14, 2017 ", Kata Beach,Chai Thaifood Restaurant,"Chai, owner of this restaurant is very friendly and kind. I always visit this restaurant with my friend when I visit Phuket."
rn458170667,"Reviewed February 8, 2017 ", Kata Beach,Chai Thaifood Restaurant,"We went looking for the Kitchen something or other but there were several restaurants with similar names on Tripadvisor, others had made the same mistake as well as the Tripadvisor photos for the same place showed pictures of different restaurants!
We had a good nose...More"
rn456817803,"Reviewed February 2, 2017 ", Kata Beach,Chai Thaifood Restaurant,"Good thai food, nice staff and very friendly owner. You would not get disappointed after eating here."
rn452977705,"Reviewed January 18, 2017 ", Kata Beach,Chai Thaifood Restaurant,"On our stop in Phuket we stayed down the road from Chai Thai. After our first visit we knew we would be regular customers it great local food and, for the quality of the food, extremely cheap. The family that run the restaurant made it...More"
rn451847348,"Reviewed January 14, 2017 ", Kata Beach,Chai Thaifood Restaurant,"Ate here due to a heavy downpour. Very average, should have picked the pizza cafe next door. If you want poor quality food at n average price it's all good
For a few dollars more you can go to the family 500 mts away and...More"
rn451018147,"Reviewed January 10, 2017 ", Kata Beach,Chai Thaifood Restaurant,"Been there, and first they didn't recognized us.
We ordered 2 currys with steamed rice. The curry was served on a plate, not in a bowl, like expected for a curry. It was absolutely not liquid. Size was so small, both of us went out,...More"
rn450774580,"Reviewed January 9, 2017 ", Kata Beach,Chai Thaifood Restaurant,"Nothing original or fancy on the main course menu but everything is fresh. The meals are tasty, and not too spicy (the sweet and sour is very well balanced in terms of ingredients)The staff is very friendly and nice. All the meals are affordable
I...More"
rn449727614,"Reviewed January 5, 2017 ", Kata Beach,Chai Thaifood Restaurant,"We loved the food, ordered Pad Thai and stirred fried noodles. Really tasty and lovely service from smiling waitresses. But don't order the Mojito, tasted like caipiriña."
rn446714537,"Reviewed December 26, 2016 ", Kata Beach,Chai Thaifood Restaurant,"Been here for almost everyday of lunch while we stay in kata beach...
They served good spring roll, chicken rice, sticky rice, pad thai and crab.
Very reasonable the prices and staff are attentive...
U will enjoy every servings they will give u."
rn444593613,"Reviewed December 16, 2016 ", Kata Beach,Chai Thaifood Restaurant,Love the crab here...so crazy fresh. I had other dishes which were just OK but the crab was so good that I am giving the restaurant five stars. Service was very friendly and this restaurant very casual...located directly opposite from Kata Lucky hotel. Prices were...More
rn443535128,"Reviewed December 11, 2016 ", Kata Beach,Chai Thaifood Restaurant,Went in for a quick lunch. Food was really good. Menu had a good range and was good value for money. Staff were efficient.
rn439412959,"Reviewed November 22, 2016 ", Kata Beach,Chai Thaifood Restaurant,My spring rolls and beef paneng were great. Remember to tell the staff if you want to have your appetizers first and then the main meal. Fast service.
rn437642437,"Reviewed November 15, 2016 ", Kata Beach,Chai Thaifood Restaurant,"Busy little place full of life ,great choice of dishes cooked well.The main man is very helpful and friendly and ensures you are well taken care of.My husband popped out to the loo but was longer than expected,I thought he had been kidnapped by aliens...More"
rn433448614,"Reviewed October 31, 2016 ", Kata Beach,Chai Thaifood Restaurant,"Very delicious food, friendly stuff, very reasonable prices,maybe the best I've seen in Thai restaurants..Been there 3 times while in Phuket,must go"
rn430230527,"Reviewed October 21, 2016 ", Kata Beach,Chai Thaifood Restaurant,"This place is visited by locals, which means thai food is good there. Tom Kha & Tom Yum are very nice. Children are welcome! Recommend!"
rn427799637,"Reviewed October 14, 2016 ", Kata Beach,Chai Thaifood Restaurant,"went there for dinner, padthai is very good and atmosphere of the place is nice.
price is cheap and good for value.
thumb up for this restaurant"
rn426864132,"Reviewed October 11, 2016 ", Kata Beach,Chai Thaifood Restaurant,Very good friendly food is good. Chai himself is a great guy would always visit if in the area . Would recommend to anyone who is in kata
rn422986055,"Reviewed September 27, 2016 ", Kata Beach,Chai Thaifood Restaurant,The food is reasonably priced and authentic. They were able to accommodate making my green curry sans meat but no tofu available. The owner is very nice and greets all the guests. The spring rolls were my favorite!
rn422783842,"Reviewed September 27, 2016 ", Kata Beach,Chai Thaifood Restaurant,"Superb food with very friendly staff.
Relatively cheap prices.
Whenever you are in Kata you should pay a visit to this restaurant."
rn422433728,"Reviewed September 26, 2016 ", Kata Beach,Chai Thaifood Restaurant,Very nice place. Just behind my hotel. Food is very yummy yummy. Special os the salah fish. Price also no expensive. Boss also are very nice guy.
rn422354734,"Reviewed September 26, 2016 ", Kata Beach,Chai Thaifood Restaurant,Tasty real thai food.you must go early because the place is full of people.lovely people a little chaos so go early.
rn421145834,"Reviewed September 22, 2016 ", Kata Beach,Chai Thaifood Restaurant,"My wife and I are Thai. We ate here not fully knowing that the Thai food would be for foreign tastebuds. When we received our order of wok-fried morning glory, fried sea bass, and tom yum soup, the sea bass was tasty, but the other...More"
rn421142814,"Reviewed September 22, 2016 ", Kata Beach,Chai Thaifood Restaurant,"Great restaurant in Kata Beach! Owner name Chai, a very simple and friendly tauke(boss), the food was so fresh and nice!"
rn421135298,"Reviewed September 22, 2016 ", Kata Beach,Chai Thaifood Restaurant,"First night in Kata, Phuket. The staff were very friendly and helpful. The food and pinacolada very tasty. Live band pretty good too."
rn420825107,"Reviewed September 21, 2016 ", Kata Beach,Chai Thaifood Restaurant,"What a great place to be in! Owner of the place, Chai, a very simple and friendly man who manages the restaurant personally. We ate here twice in 4 nights that we were there. Really awesome food. Best pad thai i ate in Thailand. Their...More"
rn419796207,"Reviewed September 18, 2016 ", Kata Beach,Chai Thaifood Restaurant,"Well I've seen tasty food but these guys know how to cook a must go place an very friendly staff an the owner is a hard case, an very cheap with good size meals <f0><U+009F><U+0091><U+008D><f0><U+009F><U+0091><U+008D>"
rn416630606,"Reviewed September 9, 2016 ", Kata Beach,Chai Thaifood Restaurant,"Great menu with loads of choice and well priced. Every dish we ordered was really tasty. We ate here twice in the 4 nights we stayed at Kata beach, deff worth a visit!"
rn415985484,"Reviewed September 7, 2016 ", Kata Beach,Chai Thaifood Restaurant,Very good food and service. Very good price for big portions. Great place to eat in or to get a takeaway. We return again and again to try the different dishes.
rn413506871,"Reviewed September 1, 2016 ", Kata Beach,Chai Thaifood Restaurant,"Prices range from 80-500, beer is 70 for small bottle.
Nice food too. Bathroom could do with soap - don't understand the widespread lack of soap in asian countries. Doesn't take away from the satisfaction of food however. Would return here for cheap and nice...More"
rn409931200,"Reviewed August 24, 2016 ", Kata Beach,Chai Thaifood Restaurant,Looks like family business. Small but comfortable place. Very tasty Thai food. This restaurant was in front of our hotel and it was a good variant when we were not going to walk somewhere else far from hotel.
rn407876982,"Reviewed August 20, 2016 ", Kata Beach,Chai Thaifood Restaurant,"Amazing Thai food, the best we have had so far on our trip, staff were all friendly, restaurant was very clean and food was delicious."
rn407325064,"Reviewed August 18, 2016 ", Kata Beach,Chai Thaifood Restaurant,"Good jobs man! Their service was good, the food very delicious!!! If i have a chance. i will not hesitate to visit chai thai foods again"
rn404457791,"Reviewed August 12, 2016 ", Kata Beach,Chai Thaifood Restaurant,"We can't understand the good rating here. I had the worst Pad Thai in my life there, which pretty much tasted like rice noodles with spicy ketchup, and my girlfriend said the same after she tasted it. Her squid salad was edible, but we would...More"
rn403225354,"Reviewed August 9, 2016 ", Kata Beach,Chai Thaifood Restaurant,"Great food great service!
Unexpected as it looks a little shabby but what ever we ordered and we ordered lots was good!people can't speak very well English but make more than the most of it due to their kindness."
rn400293632,"Reviewed August 2, 2016 ", Kata Beach,Chai Thaifood Restaurant,"Just arrived and headed here on the basis of the Trip Advisor Reviews.
We had a good mix of seafood dishes and stir fry.
All healthy and tasty.
730 Baht
3 beers
2 starters
3 mains
Rice
Can't go wrong."
rn400128787,"Reviewed August 1, 2016 ", Kata Beach,Chai Thaifood Restaurant,"The food was really good and the prices were reasonable. Not everyone speaks good English there so sometimes it takes time to explain things, but there's always someone who can help (the owner or someone from the kitchen)."
rn399968704,"Reviewed August 1, 2016 ", Kata Beach,Chai Thaifood Restaurant,Very good place. With tasty food and good prices! They also have very nice breakfasts just for 160. The owner and stuff always welcoming clients
rn396082414,"Reviewed July 24, 2016 ", Kata Beach,Chai Thaifood Restaurant,This restaurant was delicious. So authentic and the staff are so friendly. The chicken satay was the best we had in our whole stay.
rn395259867,"Reviewed July 21, 2016 ", Kata Beach,Chai Thaifood Restaurant,We would have eaten there every meal if we could. Food is delicious and very affordable. The location is a bit out of the way but worth it.
rn394559940,"Reviewed July 20, 2016 ", Kata Beach,Chai Thaifood Restaurant,"Went here for lunch on our walk to the beach.
No frills decor with some really tasty dishes. Our favourite so far!
Pad Thai, noodles with chicken, vegetables and a fresh coconut came to 300 baht.
It seemed popular compared to others in the area...More"
rn394558031,"Reviewed July 19, 2016 ", Kata Beach,Chai Thaifood Restaurant,Had lunch here today and it was great. My boyfriend and I shared 3 dishes and a coconut to drink and the total price came to 300THB. The best Pad Thai I've had in Phuket and the coconut was so sweet and fresh. Definitely go...More
rn393182378,"Reviewed July 16, 2016 ", Kata Beach,Chai Thaifood Restaurant,"It's taken us a few days but a short 200bht tuk tuk ride from Karon Beach found this off the main road restaurant. It is rated 5 star on TripAdvisor for a reason. This is genuine Thai at great prices. Super fresh, not too spicy...More"
rn390618225,"Reviewed July 9, 2016 ", Kata Beach,Chai Thaifood Restaurant,"I had to walk a bit to find this restaurant. You had to walk on the road - no sidewalks - to get to this place. It is very local, has basic dining furniture, and has decent food but I wan't overly impressed. They used...More"
rn389243169,"Reviewed July 4, 2016 ", Kata Beach,Chai Thaifood Restaurant,"The food in this restaurant is fantastic , crab curry unbelievable ,noodle soup beautiful broth, morning glory so fresh and green . Travelled up by taxi from Karong beach to go to this place based on reviews on trip advisor ,did not disappoint . One...More"
rn388302116,"Reviewed July 1, 2016 ", Kata Beach,Chai Thaifood Restaurant,"Quite small but very cosy and welcoming atmosphere. Food was great and reasonably priced. We ordered chicken satays, fried shrimp, red Thai curry, crab curry and 2 beers and the bill came to 780 baht, not bad. Staff were lovely, will definitely go again for...More"
rn387025272,"Reviewed June 28, 2016 ", Kata Beach,Chai Thaifood Restaurant,Very local restaurant with amazing Thai food the prices are more cheap than the rest. The owner very friendly
rn383914075,"Reviewed June 19, 2016 ", Kata Beach,Chai Thaifood Restaurant,"This small and cozy restaurant was really a good experience. The food was great, and then owner who serves himself, also a very friendly man.
I highly recommend taking the walk up hill from the beach, to find this little spot."
rn381549235,"Reviewed June 11, 2016 ", Kata Beach,Chai Thaifood Restaurant,"Very good restaurant. Nice personal, very pleasent people. Best restaurant in phuket island!!! Cheap and good quality!!"
rn381548557,"Reviewed June 11, 2016 ", Kata Beach,Chai Thaifood Restaurant,Awesome little place with very good local food! We enjoyed a lot having lunch in this place. Highly recommended!
rn375944326,"Reviewed May 23, 2016 ", Kata Beach,Chai Thaifood Restaurant,"Exactly my type of spot!
Friendly staff, quick efficient service and exceptionally tasty food at very cheap rates.
The flavours were very authentic and delicious and there is a good variety of different dishes to choose from, something for everyone.
We only arrived yesterday and...More"
rn375126293,"Reviewed May 21, 2016 ", Kata Beach,Chai Thaifood Restaurant,Nicest owner. Mr. Chai was really helpfull and friendly. The food was the best so far in Kata. And to top it off was at a really good price compared with the usual restaurants in the area.
rn372987634,"Reviewed May 15, 2016 ", Kata Beach,Chai Thaifood Restaurant,"We purposely came here for lunch after reading about the good reviews. Ordered 3 dishes: Tomyam goong, Morning glory and Cashewnut chicken
The good:
- Price is reasonably cheap (450 baht in total)
- Tomyam goong has 5 large prawns for 120 Baht.
- Morning...More"
rn372826714,"Reviewed May 14, 2016 ", Kata Beach,Chai Thaifood Restaurant,What a wonderful ambiance and great food. The personal attention and smile of the owner is definitely a plus! Would recommend this place to people visiting Phuket!
rn369122856,"Reviewed April 30, 2016 ", Kata Beach,Chai Thaifood Restaurant,"If you're in the area, this is one of the better places to have some Thai food. Not the most authentic, but definitely excellent value option for tourists."
rn368946068,"Reviewed April 30, 2016 ", Kata Beach,Chai Thaifood Restaurant,"Highly recommend for regional Thai food. Family atmospher, perfect Satay and delicious Phad Thai & originaly spicy curry."
rn366862673,"Reviewed April 24, 2016 ", Kata Beach,Chai Thaifood Restaurant,"We were recommended this place by a couple we met at our hotel. All I can say is that I wish we were here for the rest of our vacation as we would be eating here twice a day! Amazing food, great service and very...More"
rn362043851,"Reviewed April 6, 2016 ", Kata Beach,Chai Thaifood Restaurant,"Lucky to find this lovely friendly place to eat, basic but tasty traditional food. Very friendly atmosphere. Great prices family of 4 fed & hydrated very well (including 4 beers) for £20! Highly recommend."
rn359228598,"Reviewed March 28, 2016 ", Kata Beach,Chai Thaifood Restaurant,"We luckily stumbled upon this place as it was close to our hotel, and we were so happy we went back 1 to 2 times a day until we left! One of the best pad thais I've ever had, and then we tried the glass...More"
rn359167828,"Reviewed March 27, 2016 ", Kata Beach,Chai Thaifood Restaurant,"After a fair bit of trial and error, this ended up being our regular spot to eat. Food was always great, friendly service and very affordable. Heading back to Kata very soon and will be visiting Chai's again on the regular i'm sure."
rn358618497,"Reviewed March 25, 2016 ", Kata Beach,Chai Thaifood Restaurant,"Wonderful little Thai eatery with yummlicious authentic Thai dishes. We had the yellow crab curry (very good!), fried hor fun (flat rice noodles, excellent), som tum (not bad), and a variety of other dishes. We came back on the last day for more! Service was...More"
rn357513505,"Reviewed March 22, 2016 ", Kata Beach,Chai Thaifood Restaurant,this very simple place served the most authentic and most affordable thai food I must have eaten in Thailand for a long time. dishes were ridiculously low priced and food was of high quality (e.g. the meat was way more tender than in other places...More
rn355002010,"Reviewed March 13, 2016 ", Kata Beach,Chai Thaifood Restaurant,"A wonderfull thai food restaurant!!
All people are great and smiling! And the boss, Mr Chai is so funny!! He talk to everybody !
The food is just amazing ! I loved their pad thai prawns!!
We eat there almost everynight!!!!"
rn353277327,"Reviewed March 6, 2016 ", Kata Beach,Chai Thaifood Restaurant,"Very good thai food here . Friendly n nice staff they got . + 1 stop service ,rooms, villa n more dont be shy to ask their staff for more <f0><U+009F><U+0091><U+008D><f0><U+009F><U+008F><U+00BB><f0><U+009F><U+0091><U+008D><f0><U+009F><U+008F><U+00BB>"
rn353219752,"Reviewed March 5, 2016 ", Kata Beach,Chai Thaifood Restaurant,"A small resturant hidden in one corner. Not a fancy place, but staff are very friendly. Food is fabulous especially the red curry fish. The fish is fried normally but the thick tasty red curry sauce just makes a the normal fried fish into a...More"
rn352594890,"Reviewed March 3, 2016 ", Kata Beach,Chai Thaifood Restaurant,Food is awesome and the owner is friendly..... must try the food here... esp the red curry fish is a must try.....
rn351737192,"Reviewed February 28, 2016 ", Kata Beach,Chai Thaifood Restaurant,"Food was very good and cheap, staff was kind and quick, place is not glamorous but clean.
We stayed for 16 nights and visited other 6 restaurants, but we always came back.
Best curry I tasted on Phuket. Just go and try it."
rn351236637,"Reviewed February 26, 2016 ", Kata Beach,Chai Thaifood Restaurant,"Good food and reasonable price. Not far from Chalanai Flora Hotel.
The Tom Yum soup is different from others but very good."
rn350100659,"Reviewed February 22, 2016 ", Kata Beach,Chai Thaifood Restaurant,"A little way out from the main area, but well worth the 10 - 15 minute walk. Small, seating for about 30, and very busy. Excellent choice of food, hot, delicious, and brilliant value for money.Highly recommended!!"
rn348012754,"Reviewed February 15, 2016 ", Kata Beach,Chai Thaifood Restaurant,"I can only agree with those reviewers who state that this simple restaurant serves the best Thai dishes in Kata. It is a pity that we found it in our last 3 days in Phuket. Well, we ate there 3 times. Panang curry is a...More"
rn345308989,"Reviewed February 5, 2016 ", Kata Beach,Chai Thaifood Restaurant,"By far the best Thai I've found in Kata. This is my second trip to Kata, and still haven't found a Thai food restaurant better to eat at. The owner is so friendly, he makes you feel like your a visitor in his own home....More"
