ID,Review Date,Location,Hotel/Restaurant name,Review
rn581235855,Reviewed yesterday , Chalong,Baan Noy Restaurant,I try this restaurant yesterday during lunch time...food are all delicious and well presented...i order a salmon which is crispy outside and flavorful..staff are helpful and ready to serve your needs..only 1 negative thing i saw..staff having lunch at kitchen using the utensils and equipment...More
rn570437353,"Reviewed April 2, 2018 ", Chalong,Baan Noy Restaurant,"Fred and the team offer very good Thai food, friendly prompt service and they have created a good family friendly service.
Fred is multi-lingual speaking French, German and English fluently."
rn569421541,"Reviewed March 29, 2018 ", Chalong,Baan Noy Restaurant,Food is purely amazing and the best as is the hospitality and service. Do yourself a favor and make sure you hunt this place down and try it for yourself
rn566648680,"Reviewed March 15, 2018 ", Chalong,Baan Noy Restaurant,"This place is a must visit while being in Chalong/ Phuket. Cheep prices, the service quality is simply amazing and so are the dishes. So tasty! We couldn't have asked for more - 5 out of 5 without any doubt!More"
rn565190672,"Reviewed March 7, 2018 ", Chalong,Baan Noy Restaurant,"Entering Baan Noy restaurant is a feeling of warmth and family! Our delightful host Fred greeted us and led us to a nice table!
Our entree of shrimp wrapped in bacon was to die for, my partner ordered a delicious margarita made with precision!
Our...More"
rn563449221,"Reviewed February 28, 2018 ", Chalong,Baan Noy Restaurant,"I had dinner in this place with my girlfriend and we are really enjoy with the food and dirnk especilly the staff was so very friendly ,helpful ,I will be back in next time and I whould like to recomend in this place is the...More"
rn562033569,"Reviewed February 21, 2018 ", Chalong,Baan Noy Restaurant,"Short walk from the Chalong Circle in a comfortable setting.
We started with the best home made prawn cakes I've eaten followed by Lemon/chilli steamed fish.
Prices were reasonable for the quality of the food.
I would definitely recommend this restaurant."
rn559587376,"Reviewed February 10, 2018 ", Chalong,Baan Noy Restaurant,"3 things i looked forward to when coming back to Phuket. Sun, Beach & Baan Noy.
But to be honest, mostly Baan Noy. I have traveled alot and many places have nice beaches and sun but no Ban Noy. Baan Noy is diffrent. Its just...More"
rn559529050,"Reviewed February 9, 2018 ", Chalong,Baan Noy Restaurant,Baan Noy is the best restaurant I have been to in whole Thailand!! The food is SO GOOD and the staff and the owners are the NICEST! I eat here everytime I visit Thailand. Also every friend I bring there for their first time all...More
rn558261355,"Reviewed February 4, 2018 ", Chalong,Baan Noy Restaurant,"We, me and my wife and son, were invited here by friends who were very happy with the service we had provided on their diving trips. It comes highly recommended, so expectations were high. And the friends did not disappoint, the company was excellent.
The...More"
rn558089337,"Reviewed February 3, 2018 ", Chalong,Baan Noy Restaurant,"We came as a group of two couples, two people ordered rice with seafood and when they got it, there was sausage in the seafood. We asked to change it and they brought the same thing all over again. So we complained to the owner...More"
rn557309335,"Reviewed January 30, 2018 ", Chalong,Baan Noy Restaurant,"Perfect food and cooked fresh. Lucky us, the restaurant was empty and the foods were prepared in few minutes. The best food we had till now in our 2 weeks hear around Phuket."
rn553548125,"Reviewed January 13, 2018 ", Chalong,Baan Noy Restaurant,"My husband and I were staying 4 days in Chalong as a part of our honeymoon and went here twice. First day we had spring rolls for starters, the tenderloin and t-bone steak for main and shared a banana split for dessert. Second day we...More"
rn552391921,"Reviewed January 7, 2018 ", Chalong,Baan Noy Restaurant,"We went for lunch today. Ordered the ravioli : the sauce was very mildly tasting of curry and absolutely to die for. We're going back just for that.
Had grilled fish which was cooked to perfection.
All this for an extremely good price.
Don't hesitate,...More"
rn552362495,"Reviewed January 7, 2018 ", Chalong,Baan Noy Restaurant,"Nestled inside of one of quite side streets in Chalong, this is easily one of the top Phuket restaurants in town. They have amazing local Thai and european kitchen. Their Pad-Thai and Curries are unmatched {and so are their Cordon Bleu!}. During our 3-weeks vacation...More"
rn550919160,"Reviewed January 2, 2018 ", Chalong,Baan Noy Restaurant,"Food is really good, that chef is a miracle maker. Coconut soup - must try! Make sure to call and reserve the table, place is just a few tables but quite in high demand. Owner is very hospitable German guy."
rn548390723,"Reviewed December 21, 2017 ", Chalong,Baan Noy Restaurant,"Everything we ordered was delicious, lava cake being just amazing, every time I think of it, I want to have it again.
Owners are a lovely couple and very interesting people. We enjoyed it 100% and were sad that we didn’t manage to go there...More"
rn547861156,"Reviewed December 18, 2017 ", Chalong,Baan Noy Restaurant,"The food was good, great service and the lava cake was delicious. I won't say the food was amazing but definitely worth going if you want to get away from the noise and busy places. The deep fried spinach salad was so good!More"
rn547714071,"Reviewed December 17, 2017 ", Chalong,Baan Noy Restaurant,"Too bad that we found the restaurant until the end of the holiday!
They offer both: Thai food as well exquisite European food. We had both and we enjoyed it much. The fillet mignon and the red curry (extra Thai spicy ;-) are legendary.
This...More"
rn543501070,"Reviewed November 26, 2017 ", Chalong,Baan Noy Restaurant,"Great Thai beef salad
( just needed the sticky rice)
Good quality beef & great taste
Lava cake was fresh not from a packet was worth the 15 min wait
Great service & always clean
It’s a 15 min motorbike ride from Rawai but always...More"
rn542228306,"Reviewed November 20, 2017 ", Chalong,Baan Noy Restaurant,"This restaurant lives up to the good reviews. The food was delicious with large servings. The owners came and spoke with us, really making certain that we had no problems and were happy with the meal and service.
Particularly special were the duck curry, coconut...More"
rn536082567,"Reviewed October 25, 2017 ", Chalong,Baan Noy Restaurant,"After long time we went back to this restaurant and it has been a very pleasant dinner : warm welcoming and excellent food !
We had a good rice with pineapple, a very good garlic and pepper prawn and a wonderful yellow curry prawn.
Without...More"
rn535681361,"Reviewed October 24, 2017 ", Chalong,Baan Noy Restaurant,"This is the best restaurant where we have eaten so far. It was impressive to see how the Chef prepared the food for multiple tables, you could see her cooking in an open kitchen.
There was an extensive menu to choose from (Thai and European...More"
rn532770987,"Reviewed October 13, 2017 ", Chalong,Baan Noy Restaurant,"Not really impressed with this restaurant the service was friendly enough but nothing put of the ordinary.
The food was fairly average and the servings quite small. Average dish is about 140b but you can get much better for half the price.
There wasnt much...More"
rn530716871,"Reviewed October 7, 2017 ", Chalong,Baan Noy Restaurant,The best Mushroom soup on the planet!!! I have eaten there on numerous occasions and each time I leave after been served the finest hospitality and cuisine the Island has to offer.More
rn528397533,"Reviewed September 29, 2017 ", Chalong,Baan Noy Restaurant,"Nice place but average food!
Even they have a big sign at the main road it was still hard to find at night with heavy rain. Other than the small “way” the restaurant is nice and the owners and staff very friendly.
The European food...More"
rn522300751,"Reviewed September 7, 2017 ", Chalong,Baan Noy Restaurant,"We absolutely loved our visit at the Baan Noy Restaurant - the best Thai food we have ever had and extremely sincere service. The restaurant owners welcomed us very nicely, told us various stories about their business and the Thailand experience. We think our visit...More"
rn517038298,"Reviewed August 24, 2017 ", Chalong,Baan Noy Restaurant,"We had a lovely evening with a warm hospitality, friendly place for a relaxed evening. The food was delicious and was served with a smile. Thank u, we had a great time."
rn511938381,"Reviewed August 12, 2017 ", Chalong,Baan Noy Restaurant,"We ate at Baan Noy Restaurant three times during our five day trip to Phuket. We stayed within walking distance of this gem of a restaurant and kept going back. The family-run restaurant offers delicious food, attentive service, and a charming ambiance. The Thai green...More"
rn510567173,"Reviewed August 9, 2017 ", Chalong,Baan Noy Restaurant,The owners are a German-Thai couple and you can see the good aspects of the German influence combined with the tasty Thai kitchen. It's very clean and the staff was more than friendly and attentive. The portions were good and the price was adequately. We...More
rn498927396,"Reviewed July 5, 2017 ", Chalong,Baan Noy Restaurant,"We arrived at this restaurant in a complete downpour. We were greeted at the taxi with umbrellas, service is awesome. The lady that takes your order also cooks your food which is a nice touch and shows how fresh the whole menu is. The best...More"
rn494439040,"Reviewed June 19, 2017 ", Chalong,Baan Noy Restaurant,"Thai and European restaurant! During 3 days trip in Phuket, we went there to have diner and lunch twice! + one take away! Excellent food made by a five stars chef Tai and her husband Fred, from Germany!
Customer service perfect! Amazing!More"
rn493882752,"Reviewed June 17, 2017 ", Chalong,Baan Noy Restaurant,"I had the sliced duck in an orange sauce and it was really very good. The restaurant was quite hard to find however the food quality was great. My girlfriend had a red curry with duck which was also of very good quality, I would...More"
rn493688905,"Reviewed June 17, 2017 ", Chalong,Baan Noy Restaurant,"My wife and I really enjoyed this restaurant. The food was authentic Thai and it was absolutely delicious.
The restaurant is off the beaten track a little in that it's just off the main street, but it is well worth the effort finding it.
We...More"
rn493128896,"Reviewed June 14, 2017 ", Chalong,Baan Noy Restaurant,"While in Phuket for 5 days, we asked our Put Put Driver, Thiem, to recommend an exceptional Thaï restaurant. He had heard of Baan Noy, was not sure where it was and looked it up on his cell phone. He drove 6 of us there,...More"
rn492932145,"Reviewed June 14, 2017 ", Chalong,Baan Noy Restaurant,The staff at Baan Noy were very tentative and friendly. The food was amazing! Try the honey roasted pork ribs! Definitely recommend paying this hidden jewel a visit.
rn492627823,"Reviewed June 12, 2017 ", Chalong,Baan Noy Restaurant,"Extraordinary place in the middle of nowhere on Phuket.
Very quiet place with perfect food and friendly owner, who glad to chat with guest.More"
rn491556735,"Reviewed June 8, 2017 ", Chalong,Baan Noy Restaurant,"Found several reviews on this restaurant and a bunch of us decided to go for dinner. No reservations were necessary, but then again we were there in low season.
We were very skeptical when we got there as the restaurant is tacked away down in...More"
rn491436257,"Reviewed June 8, 2017 ", Chalong,Baan Noy Restaurant,"It is very simple, but very tasty, warm and welcome place! I have a lunch here almost every day, I think the best tom yam I tested, actually big choice of good fish. Do recommend to visit!"
rn487602331,"Reviewed May 25, 2017 ", Chalong,Baan Noy Restaurant,"Came here because of TripAdvisor recommendation. I was a little bit skeptical a first, but honestly the best restaurant I've ever had in Chalong, let along Thailand itself.More"
rn483621118,"Reviewed May 12, 2017 ", Chalong,Baan Noy Restaurant,"A group of us went to have dinner at Baan Noy and were extremely happy with it! The food was the best we had in the area and the owner/chef and her husband were very hospitable. The staff was excellent and helpful.
The highlight of...More"
rn483160392,"Reviewed May 10, 2017 ", Chalong,Baan Noy Restaurant,"Excellent Thai food, restaurant is away from the street which gives it a more quiet and classy ambiance."
rn482845428,"Reviewed May 9, 2017 ", Chalong,Baan Noy Restaurant,Just incase anyone was wondering this little restaurant has not lost its charm or its quality in food. we hadn't been for a while but returned for lunch and had a super meal the only thing that I was sad about was I was too...More
rn481147597,"Reviewed May 2, 2017 ", Chalong,Baan Noy Restaurant,"This restaurant is in the top of my favorite restaurants in Phuket. All dishes prepared with love and personality. We tried almost everything.
From starters I would like to mention spring rolls with shrimp and shrimp wrapped in bacon - real jam!
From the main...More"
rn477852157,"Reviewed April 21, 2017 ", Chalong,Baan Noy Restaurant,The place is a little off the main road. We arrived about 30 min early before the place opened but were greeted with a warm welcome from the owner and other staff. He allowed us to sit and start with coffee as they prepared the...More
rn477317830,"Reviewed April 19, 2017 ", Chalong,Baan Noy Restaurant,We were advised to visit this restaurant by friends in South Africa. This is our third visit in one week. What a lovely family atmosphere & we were given a great welcome each time. We could see that they have regular visitors who have continued...More
rn473529175,"Reviewed April 8, 2017 ", Chalong,Baan Noy Restaurant,"Food, service, atmosphere - everything was just perfect. Recommend to everybody! We visited this restaurant 3 days in a row and every day discovered different dishes. That was worth of trying"
rn472909887,"Reviewed April 5, 2017 ", Chalong,Baan Noy Restaurant,"We came here based on the Trip Advisor reviews and rating. We were not disappointed. We had Thai food, and all dishes were very good. The duck red curry was really flavoursome, so was the fish and mango salad.More"
rn471094506,"Reviewed March 29, 2017 ", Chalong,Baan Noy Restaurant,The food was very tasty and the service excellent. Good thai kitchen. All the dessert tasted all were delicious. definitely recommendable.
rn471094498,"Reviewed March 29, 2017 ", Chalong,Baan Noy Restaurant,"Service and food is fantastic.
Really good Thai food.
I can recommend the Chocolate Lava cake.
We will come again :)More"
rn470797391,"Reviewed March 28, 2017 ", Chalong,Baan Noy Restaurant,"I should have reviewd this place long time ago. I have been living in Phuket past few months and have tried many resturants. This one is without a doubt the BEST. Owners are super friendly and the food is amazing.
When you eat the food...More"
rn463674825,"Reviewed March 1, 2017 ", Chalong,Baan Noy Restaurant,I am Thai but living in the UK and so needed to give this place a try and found the food very pleasant. Ordered the shrimp cakes for starter which we were told were homemade and we could definately tell - beautiful! My partner and...More
rn463253528,"Reviewed February 27, 2017 ", Chalong,Baan Noy Restaurant,"Well, today I decided to take my girlfriend out for a romantic diner in Chalong, Phuket. I found this place using tripadvisor and followed the reviews.
I wasn't disappointed at all...yes it was hard to find (when you see the sign: it doesn't mean ""next...More"
rn462510411,"Reviewed February 24, 2017 ", Chalong,Baan Noy Restaurant,"German owner with German precision in every way
We went after good TA reviews and aren't disappointed
Real Clean Table cloths
Real napkins not paper
Everything is clean no in fact spotless !
Smiling staff
Polite staff
Polite owner
Fast service
Not thai style we...More"
rn461088886,"Reviewed February 19, 2017 ", Chalong,Baan Noy Restaurant,"Fred & Tai made us feel like we were their guests in the restaurant, not just a customer. The food was amazing, I've never had Thai food this good before. To finish the evening with lovely Lava Cake just superb. We loved the food and...More"
rn458647266,"Reviewed February 11, 2017 ", Chalong,Baan Noy Restaurant,"We have travelled around Asia for the past 20 years and had a few thai dishes during that time. My Wife loves green chicken curry but has been unable to find the perfect curry ...
until finding this restaurant that is. It's not often I...More"
rn458427130,"Reviewed February 9, 2017 ", Chalong,Baan Noy Restaurant,"It is located in a house on a small alley. Took us some time to find it. There's a signage before turning in to the road, look closely if not you'll miss it. Food were really delicious. We had the red curry and coconuts were...More"
rn457614798,"Reviewed February 6, 2017 ", Chalong,Baan Noy Restaurant,"Went for dinner with a friend, ordered 6 items on the menu (apart from drinks) - the food and service exceeded expectations. The owner came later and he was very friendly with all guests, making sure everything was fine at all tables. It was almost...More"
rn456479672,"Reviewed February 1, 2017 ", Chalong,Baan Noy Restaurant,It did not meet my expectation.... it was around 3ish PM when we arrived after walking in the hot sun and was expecting the food and service to be great having read a lot of wonderful reviews. It was such a disappointment… the service was...More
rn456380215,"Reviewed February 1, 2017 ", Chalong,Baan Noy Restaurant,"Went for dinner with our 2 kids - both European and Thai food was delicious, a scallop starter the standout dish. Great value ice-cream for the kids. Really friendly owners too - we'll be back!"
rn456049497,"Reviewed January 30, 2017 ", Chalong,Baan Noy Restaurant,"This place does not look like much, but the food is really good and staff is very friendly.
Both menus are very good ( western and thai ). We had lamb shops and pad thai. Both very tasty."
rn455923870,"Reviewed January 30, 2017 ", Chalong,Baan Noy Restaurant,Can't understand how this ordinary local restaurant is getting such rave reviews. No way can this be placed in the top 10 of 2500 restaurants in Phuket. The menu and decor is similar to 1000's of other local Thai places .. nothing distinctive. I had...More
rn455103925,"Reviewed January 26, 2017 ", Chalong,Baan Noy Restaurant,"I had a tender beef with great peppersauce. Best restaurant in the area/ Chalong.
Best regards Nikolaj Filtenborg Weir"
rn454869619,"Reviewed January 25, 2017 ", Chalong,Baan Noy Restaurant,"Went to restaurant on our last night with friends and it lived up to its reputation.
Great service.
Great mojitos.
Food all freshly cooked.
Yellow noodles with prawns- delicious.
However icing on the meal was chocolate lava cake with ice cream.-- we shared two between...More"
rn454401227,"Reviewed January 23, 2017 ", Chalong,Baan Noy Restaurant,"The best restaurant on Phuket!
Friendly stuff good food in a quiet place environment
I aet there several times during the same trip."
rn453042440,"Reviewed January 18, 2017 ", Chalong,Baan Noy Restaurant,"Beautiful setting, away from the big road, with only a handful tables. Mains are good, but the chocolate lava cake for desert is the real highlight! Make sure to order min. one!More"
rn452127591,"Reviewed January 15, 2017 ", Chalong,Baan Noy Restaurant,Very cute place with so delicious menu. We were tasted a lot of different thinks: shrimps in the beacon; salmon in the grill with vegetables; thai noodles with sea food and of course the best dessert chocolate cake with ice cream; everything was cooked very...More
rn451828005,"Reviewed January 13, 2017 ", Chalong,Baan Noy Restaurant,"I've just moved into a nice new condo in the area, so love this place on my doorstep... Very nice food with nice and friendly service..More"
rn451184774,"Reviewed January 11, 2017 ", Chalong,Baan Noy Restaurant,"Hands down the best restaurant in Phuket. Located in a quite street, this little restaurant is perfect for a quite and romantic night out. I had the duck and my partner had the fish, both dishes were to die for. (The flavours were something else)...More"
rn450127415,"Reviewed January 7, 2017 ", Chalong,Baan Noy Restaurant,"Frank and Tai are two of the nicest and most genuine people we have ever met! Thanks again Trip Advisor for finding us this gem of a restaurant!
From start to finish, we were welcomed with open arms - literally! We had great food, great...More"
rn449863428,"Reviewed January 6, 2017 ", Chalong,Baan Noy Restaurant,"We had this place recommended to us by a local ex-pat. The food was so good, we returned 5 nights out of the 7 we were in Phuket. The only down-side is that the owner, Fred needs to change the music occasionally. I still have...More"
rn449530322,"Reviewed January 5, 2017 ", Chalong,Baan Noy Restaurant,"We came to this restaurant with our kids to have a dinner. We came especially from an island outside Phuket. We had a long drive but it was all worth it.
We had a fantastic dinner over there. We had a Thai food where our...More"
rn449022915,"Reviewed January 3, 2017 ", Chalong,Baan Noy Restaurant,"I liked the no-frills yet charming venue. Because you clearly go to Baan Noy for the food, the glorious Thai food!
Great service and reasonable prices.
Highly recommended.More"
rn448771201,"Reviewed January 2, 2017 ", Chalong,Baan Noy Restaurant,"We chose this restaurant further to the comments I read and I can confirm that the thai food is very good (we didn't test European food).
Everything is cooked at the demand with fresh ingredients therefore it takes some time to be prepared and despite...More"
rn446622249,"Reviewed December 25, 2016 ", Chalong,Baan Noy Restaurant,"This little gem is tucked away, but well worth looking for. The food is amazing - fresh & delicious - (the Tom Yum Goong is easily the best we've eaten & our Scallop entree was to die for). The restaurant is small but homey &...More"
rn446291578,"Reviewed December 23, 2016 ", Chalong,Baan Noy Restaurant,Our first time in Phuket staying in Karon and totally underwhelmed by the identikit production line Thai food places at over inflated prices until... we found Baan Noy ( by recommendation on TA). Fred and his wife are the perfect hosts whilst they share lovingly...More
rn443050484,"Reviewed December 9, 2016 ", Chalong,Baan Noy Restaurant,"Okay.. what we tried .. end to start
Krepe ice cream.. coconut and strawberries... FRESH and WOW!!
Yellow Noodles with Veg and Chicken... The Best!!
Fried Rice Vegetables with Egg... Amazing!!
And 4 more plates. We finished them all even though we were full at...More"
rn442862117,"Reviewed December 8, 2016 ", Chalong,Baan Noy Restaurant,"Down and out restaurant, few tables under a tarpaulin tenses between two bare walls.
Low quality dishes. Very Bad experience. I'll never come back!
My opinion this is the worse risto in Chalong/Phuket.More"
rn441309345,"Reviewed December 1, 2016 ", Chalong,Baan Noy Restaurant,"Our taxi driver knew exactly where to go, and told us he had heard a lot of positive feedback...he then took us off a side road and down an alley, and there appears this open fronted diner, unpretentious, but filled with love.
My wife and...More"
rn441224526,"Reviewed November 30, 2016 ", Chalong,Baan Noy Restaurant,"Prices, customer service, portions, and plate time are perfect! The staff was very quick and eager to get us fed. My husband and I showed up to this little 'hole in the wall' where we were welcomed and seated. There aren't too many tables here...More"
rn440200229,"Reviewed November 26, 2016 ", Chalong,Baan Noy Restaurant,"Found by coincidence this restaurant on TripAdvisor. For us it was a long drive from north of Phuket town area but ............. it was well worth the trip !
Excellent food, good service and friendly owners.
It's not easy to find so you can really...More"
rn438509985,"Reviewed November 19, 2016 ", Chalong,Baan Noy Restaurant,"We arrived thirty minutes before closing and despite of it we were received well, had advice on what to eat and the food was well prepared. We asked for chiken fried noodles and for rice with pineapple, which was delicious. We finished the night with...More"
rn437420710,"Reviewed November 15, 2016 ", Chalong,Baan Noy Restaurant,"We visited the restaurant today, based on the good reviews we read in TripAdvisor. Although it is almost hidden, I feel lucky we eventually found it. It reminded me a lot the setup of a Greek restaurant, so from the beginning it felt quite familiar....More"
rn437311429,"Reviewed November 14, 2016 ", Chalong,Baan Noy Restaurant,"Went with my sister and her husband who happen to live near by but had not been here. We asked for recomendations and the mangosteen seafood salad was just beautiful..I could have had another serve, also the fresh vegie stir fry , scallops and whole...More"
rn437014762,"Reviewed November 13, 2016 ", Chalong,Baan Noy Restaurant,"This place is wonderful with amazing food, perfect for a homestyle lunch / dinner. Served by a lovely family. You will not eat better in Phuket!"
rn435827788,"Reviewed November 9, 2016 ", Chalong,Baan Noy Restaurant,"Amazing food here, had the chicken with cashew nut, roasted red duck curry and honey ribs which was all really really good local Thai food. Then topped off the amazing meal with the famous lava cake which didn't disappoint!!
Defiantly worth a visit to this...More"
